{
  "$schema": "https://json-schema.org/draft/2020-12/schema",
  "$id": "https://our-many-worlds.local/schemas/continuity-baton-v2.schema.json",
  "title": "continuity-baton-v2",
  "type": "object",
  "additionalProperties": false,
  "properties": {
    "schemaVersion": {
      "const": "dm1566_continuity_baton_v2"
    },
    "basedOnSceneId": {
      "type": "string",
      "minLength": 1
    },
    "currentDateAndTime": {
      "type": [
        "string",
        "null"
      ]
    },
    "characterPositions": {
      "type": "array",
      "items": {
        "type": "object",
        "additionalProperties": false,
        "properties": {
          "stateId": {
            "type": "string",
            "minLength": 1
          },
          "subjectRef": {
            "type": "string",
            "minLength": 1
          },
          "statement": {
            "type": "string",
            "minLength": 1
          },
          "status": {
            "type": "string",
            "minLength": 1
          },
          "sourceClaimIds": {
            "type": "array",
            "items": {
              "type": "string",
              "minLength": 1
            },
            "minItems": 1
          }
        },
        "required": [
          "stateId",
          "subjectRef",
          "statement",
          "status",
          "sourceClaimIds"
        ]
      },
      "minItems": 0
    },
    "characterKnowledge": {
      "type": "array",
      "items": {
        "type": "object",
        "additionalProperties": false,
        "properties": {
          "stateId": {
            "type": "string",
            "minLength": 1
          },
          "subjectRef": {
            "type": "string",
            "minLength": 1
          },
          "statement": {
            "type": "string",
            "minLength": 1
          },
          "status": {
            "type": "string",
            "minLength": 1
          },
          "sourceClaimIds": {
            "type": "array",
            "items": {
              "type": "string",
              "minLength": 1
            },
            "minItems": 1
          }
        },
        "required": [
          "stateId",
          "subjectRef",
          "statement",
          "status",
          "sourceClaimIds"
        ]
      },
      "minItems": 0
    },
    "activeGoals": {
      "type": "array",
      "items": {
        "type": "object",
        "additionalProperties": false,
        "properties": {
          "stateId": {
            "type": "string",
            "minLength": 1
          },
          "subjectRef": {
            "type": "string",
            "minLength": 1
          },
          "statement": {
            "type": "string",
            "minLength": 1
          },
          "status": {
            "type": "string",
            "minLength": 1
          },
          "sourceClaimIds": {
            "type": "array",
            "items": {
              "type": "string",
              "minLength": 1
            },
            "minItems": 1
          }
        },
        "required": [
          "stateId",
          "subjectRef",
          "statement",
          "status",
          "sourceClaimIds"
        ]
      },
      "minItems": 0
    },
    "relationships": {
      "type": "array",
      "items": {
        "type": "object",
        "additionalProperties": false,
        "properties": {
          "stateId": {
            "type": "string",
            "minLength": 1
          },
          "subjectRef": {
            "type": "string",
            "minLength": 1
          },
          "statement": {
            "type": "string",
            "minLength": 1
          },
          "status": {
            "type": "string",
            "minLength": 1
          },
          "sourceClaimIds": {
            "type": "array",
            "items": {
              "type": "string",
              "minLength": 1
            },
            "minItems": 1
          }
        },
        "required": [
          "stateId",
          "subjectRef",
          "statement",
          "status",
          "sourceClaimIds"
        ]
      },
      "minItems": 0
    },
    "resources": {
      "type": "array",
      "items": {
        "type": "object",
        "additionalProperties": false,
        "properties": {
          "stateId": {
            "type": "string",
            "minLength": 1
          },
          "subjectRef": {
            "type": "string",
            "minLength": 1
          },
          "statement": {
            "type": "string",
            "minLength": 1
          },
          "status": {
            "type": "string",
            "minLength": 1
          },
          "sourceClaimIds": {
            "type": "array",
            "items": {
              "type": "string",
              "minLength": 1
            },
            "minItems": 1
          }
        },
        "required": [
          "stateId",
          "subjectRef",
          "statement",
          "status",
          "sourceClaimIds"
        ]
      },
      "minItems": 0
    },
    "objectCustody": {
      "type": "array",
      "items": {
        "type": "object",
        "additionalProperties": false,
        "properties": {
          "stateId": {
            "type": "string",
            "minLength": 1
          },
          "subjectRef": {
            "type": "string",
            "minLength": 1
          },
          "statement": {
            "type": "string",
            "minLength": 1
          },
          "status": {
            "type": "string",
            "minLength": 1
          },
          "sourceClaimIds": {
            "type": "array",
            "items": {
              "type": "string",
              "minLength": 1
            },
            "minItems": 1
          }
        },
        "required": [
          "stateId",
          "subjectRef",
          "statement",
          "status",
          "sourceClaimIds"
        ]
      },
      "minItems": 0
    },
    "institutionalDecisions": {
      "type": "array",
      "items": {
        "type": "object",
        "additionalProperties": false,
        "properties": {
          "stateId": {
            "type": "string",
            "minLength": 1
          },
          "subjectRef": {
            "type": "string",
            "minLength": 1
          },
          "statement": {
            "type": "string",
            "minLength": 1
          },
          "status": {
            "type": "string",
            "minLength": 1
          },
          "sourceClaimIds": {
            "type": "array",
            "items": {
              "type": "string",
              "minLength": 1
            },
            "minItems": 1
          }
        },
        "required": [
          "stateId",
          "subjectRef",
          "statement",
          "status",
          "sourceClaimIds"
        ]
      },
      "minItems": 0
    },
    "unresolvedPromises": {
      "type": "array",
      "items": {
        "type": "object",
        "additionalProperties": false,
        "properties": {
          "stateId": {
            "type": "string",
            "minLength": 1
          },
          "subjectRef": {
            "type": "string",
            "minLength": 1
          },
          "statement": {
            "type": "string",
            "minLength": 1
          },
          "status": {
            "type": "string",
            "minLength": 1
          },
          "sourceClaimIds": {
            "type": "array",
            "items": {
              "type": "string",
              "minLength": 1
            },
            "minItems": 1
          }
        },
        "required": [
          "stateId",
          "subjectRef",
          "statement",
          "status",
          "sourceClaimIds"
        ]
      },
      "minItems": 0
    },
    "openThreats": {
      "type": "array",
      "items": {
        "type": "object",
        "additionalProperties": false,
        "properties": {
          "stateId": {
            "type": "string",
            "minLength": 1
          },
          "subjectRef": {
            "type": "string",
            "minLength": 1
          },
          "statement": {
            "type": "string",
            "minLength": 1
          },
          "status": {
            "type": "string",
            "minLength": 1
          },
          "sourceClaimIds": {
            "type": "array",
            "items": {
              "type": "string",
              "minLength": 1
            },
            "minItems": 1
          }
        },
        "required": [
          "stateId",
          "subjectRef",
          "statement",
          "status",
          "sourceClaimIds"
        ]
      },
      "minItems": 0
    },
    "secretsNotYetKnown": {
      "type": "array",
      "items": {
        "type": "object",
        "additionalProperties": false,
        "properties": {
          "stateId": {
            "type": "string",
            "minLength": 1
          },
          "subjectRef": {
            "type": "string",
            "minLength": 1
          },
          "statement": {
            "type": "string",
            "minLength": 1
          },
          "status": {
            "type": "string",
            "minLength": 1
          },
          "sourceClaimIds": {
            "type": "array",
            "items": {
              "type": "string",
              "minLength": 1
            },
            "minItems": 1
          }
        },
        "required": [
          "stateId",
          "subjectRef",
          "statement",
          "status",
          "sourceClaimIds"
        ]
      },
      "minItems": 0
    },
    "openCausalChains": {
      "type": "array",
      "items": {
        "type": "object",
        "additionalProperties": false,
        "properties": {
          "stateId": {
            "type": "string",
            "minLength": 1
          },
          "subjectRef": {
            "type": "string",
            "minLength": 1
          },
          "statement": {
            "type": "string",
            "minLength": 1
          },
          "status": {
            "type": "string",
            "minLength": 1
          },
          "sourceClaimIds": {
            "type": "array",
            "items": {
              "type": "string",
              "minLength": 1
            },
            "minItems": 1
          }
        },
        "required": [
          "stateId",
          "subjectRef",
          "statement",
          "status",
          "sourceClaimIds"
        ]
      },
      "minItems": 0
    },
    "causesWaitingForConsequences": {
      "type": "array",
      "items": {
        "type": "object",
        "additionalProperties": false,
        "properties": {
          "stateId": {
            "type": "string",
            "minLength": 1
          },
          "subjectRef": {
            "type": "string",
            "minLength": 1
          },
          "statement": {
            "type": "string",
            "minLength": 1
          },
          "status": {
            "type": "string",
            "minLength": 1
          },
          "sourceClaimIds": {
            "type": "array",
            "items": {
              "type": "string",
              "minLength": 1
            },
            "minItems": 1
          }
        },
        "required": [
          "stateId",
          "subjectRef",
          "statement",
          "status",
          "sourceClaimIds"
        ]
      },
      "minItems": 0
    },
    "unresolvedAliases": {
      "type": "array",
      "items": {
        "type": "object",
        "additionalProperties": false,
        "properties": {
          "stateId": {
            "type": "string",
            "minLength": 1
          },
          "subjectRef": {
            "type": "string",
            "minLength": 1
          },
          "statement": {
            "type": "string",
            "minLength": 1
          },
          "status": {
            "type": "string",
            "minLength": 1
          },
          "sourceClaimIds": {
            "type": "array",
            "items": {
              "type": "string",
              "minLength": 1
            },
            "minItems": 1
          }
        },
        "required": [
          "stateId",
          "subjectRef",
          "statement",
          "status",
          "sourceClaimIds"
        ]
      },
      "minItems": 0
    },
    "sourceArtifactIds": {
      "type": "array",
      "items": {
        "type": "string",
        "minLength": 1
      },
      "minItems": 1
    }
  },
  "required": [
    "schemaVersion",
    "basedOnSceneId",
    "currentDateAndTime",
    "characterPositions",
    "characterKnowledge",
    "activeGoals",
    "relationships",
    "resources",
    "objectCustody",
    "institutionalDecisions",
    "unresolvedPromises",
    "openThreats",
    "secretsNotYetKnown",
    "openCausalChains",
    "causesWaitingForConsequences",
    "unresolvedAliases",
    "sourceArtifactIds"
  ]
}
